{
  "schema_version": "ldsdt.deployment/v1",
  "submission": {
    "stage": "model-deployment",
    "team_id": "team-07"
  },
  "model": {
    "registry_id": "course-model-7b",
    "precision": "bf16",
    "quantization": "none"
  },
  "runtime": {
    "backend": "course-runtime",
    "version": "1.0.0",
    "mode": "native"
  },
  "service": {
    "host": "0.0.0.0",
    "port_env": "LDSDT_SERVICE_PORT",
    "health_path": "/healthz",
    "info_path": "/course/v1/info",
    "chat_path": "/v1/chat/completions"
  },
  "capabilities": {
    "streaming": true,
    "max_context_length": 4096
  },
  "resources": {
    "accelerator_count": 1
  },
  "artifacts": {
    "log_path": ".ldsdt/logs/service.log"
  }
}
